{
  "version": 1,
  "round": 1,
  "generated": "2026-10-13T12:30:00+00:00",
  "clusters": [
    {
      "cluster": "K1",
      "title": "Retracted source novak2020",
      "severity": "major",
      "members": [
        {
          "reviewer": "agy",
          "author": "claude-paper",
          "pass": "evidence",
          "id": "M2"
        },
        {
          "reviewer": "codex-review",
          "author": "codex-paper",
          "pass": "evidence",
          "id": "M2"
        },
        {
          "reviewer": "codex-paper",
          "author": "agy",
          "pass": "evidence",
          "id": "M2"
        }
      ],
      "flags": [
        "F1"
      ],
      "agreement": "majority",
      "evidence_for": [
        {
          "doi": "10.5555/rbd.2020.014",
          "quote": "Crossref update-to: retraction (2023)",
          "source": "crossref",
          "stance": "neutral",
          "flag": "F1"
        }
      ],
      "evidence_against": [],
      "blocker": true,
      "blocker_reason": "retracted",
      "scite_status": "ok",
      "recommendation": "accept",
      "rationale": "The cited source was retracted; replace it."
    },
    {
      "cluster": "K2",
      "title": "Diagnostic-accuracy claim overstated",
      "severity": "major",
      "members": [
        {
          "reviewer": "agy",
          "author": "claude-paper",
          "pass": "blind",
          "id": "M1"
        },
        {
          "reviewer": "agy",
          "author": "claude-paper",
          "pass": "evidence",
          "id": "M1"
        },
        {
          "reviewer": "codex-review",
          "author": "claude-paper",
          "pass": "blind",
          "id": "M1"
        },
        {
          "reviewer": "codex-review",
          "author": "claude-paper",
          "pass": "evidence",
          "id": "M1"
        },
        {
          "reviewer": "claude-paper",
          "author": "codex-paper",
          "pass": "blind",
          "id": "M1"
        },
        {
          "reviewer": "claude-paper",
          "author": "codex-paper",
          "pass": "evidence",
          "id": "M1"
        },
        {
          "reviewer": "codex-review",
          "author": "codex-paper",
          "pass": "blind",
          "id": "M1"
        },
        {
          "reviewer": "codex-review",
          "author": "codex-paper",
          "pass": "evidence",
          "id": "M1"
        },
        {
          "reviewer": "codex-paper",
          "author": "agy",
          "pass": "blind",
          "id": "M1"
        },
        {
          "reviewer": "codex-paper",
          "author": "agy",
          "pass": "evidence",
          "id": "M1"
        },
        {
          "reviewer": "codex-review",
          "author": "agy",
          "pass": "blind",
          "id": "M1"
        },
        {
          "reviewer": "codex-review",
          "author": "agy",
          "pass": "evidence",
          "id": "M1"
        }
      ],
      "flags": [
        "F2"
      ],
      "agreement": "consensus",
      "evidence_for": [
        {
          "doi": "10.5555/rbd.2019.001",
          "quote": "In contrast to Smith et al., actigraphy alone did not separate RBD from periodic limb movements.",
          "source": "scite_mcp",
          "stance": "contrasting",
          "flag": "F2"
        }
      ],
      "evidence_against": [
        {
          "doi": "10.5555/rbd.2022.003",
          "quote": "Wrist actigraphy flagged dream-enactment episodes confirmed by video-polysomnography.",
          "source": "europepmc",
          "stance": "supporting"
        }
      ],
      "blocker": false,
      "scite_status": "ok",
      "recommendation": "accept",
      "rationale": "Every reviewer raised it; a contrasting replication exists."
    },
    {
      "cluster": "K3",
      "title": "Define RBD at first use",
      "severity": "minor",
      "members": [
        {
          "reviewer": "agy",
          "author": "claude-paper",
          "pass": "blind",
          "id": "m1"
        },
        {
          "reviewer": "agy",
          "author": "claude-paper",
          "pass": "evidence",
          "id": "m1"
        },
        {
          "reviewer": "claude-paper",
          "author": "codex-paper",
          "pass": "blind",
          "id": "m1"
        },
        {
          "reviewer": "claude-paper",
          "author": "codex-paper",
          "pass": "evidence",
          "id": "m1"
        },
        {
          "reviewer": "codex-paper",
          "author": "agy",
          "pass": "blind",
          "id": "m1"
        },
        {
          "reviewer": "codex-paper",
          "author": "agy",
          "pass": "evidence",
          "id": "m1"
        }
      ],
      "agreement": "majority",
      "evidence_for": [],
      "evidence_against": [],
      "blocker": false,
      "scite_status": "ok",
      "recommendation": "accept",
      "rationale": "Three reviewers asked for it."
    },
    {
      "cluster": "K4",
      "title": "Device sampling rate missing",
      "severity": "minor",
      "members": [
        {
          "reviewer": "codex-review",
          "author": "claude-paper",
          "pass": "blind",
          "id": "m1"
        },
        {
          "reviewer": "codex-review",
          "author": "claude-paper",
          "pass": "evidence",
          "id": "m1"
        }
      ],
      "agreement": "single",
      "evidence_for": [],
      "evidence_against": [],
      "blocker": false,
      "scite_status": "ok",
      "recommendation": "accept",
      "rationale": "Needed for reproducibility."
    },
    {
      "cluster": "K5",
      "title": "Figure 2 y-axis label",
      "severity": "minor",
      "members": [
        {
          "reviewer": "codex-review",
          "author": "codex-paper",
          "pass": "blind",
          "id": "m1"
        },
        {
          "reviewer": "codex-review",
          "author": "codex-paper",
          "pass": "evidence",
          "id": "m1"
        }
      ],
      "agreement": "single",
      "evidence_for": [],
      "evidence_against": [],
      "blocker": false,
      "scite_status": "ok",
      "recommendation": "reject",
      "rationale": "The caption already names the axis."
    },
    {
      "cluster": "K6",
      "title": "Novelty claim overstated",
      "severity": "minor",
      "members": [
        {
          "reviewer": "codex-review",
          "author": "agy",
          "pass": "blind",
          "id": "m1"
        },
        {
          "reviewer": "codex-review",
          "author": "agy",
          "pass": "evidence",
          "id": "m1"
        }
      ],
      "flags": [
        "F4"
      ],
      "agreement": "single",
      "evidence_for": [
        {
          "doi": "10.5555/rbd.2024.021",
          "quote": "We present a wearable-only screening pipeline for isolated RBD.",
          "source": "scite_mcp",
          "stance": "contrasting",
          "flag": "F4"
        }
      ],
      "evidence_against": [],
      "blocker": false,
      "scite_status": "ok",
      "recommendation": "accept",
      "rationale": "A 2024 study reports a wearable-only screening pipeline."
    },
    {
      "cluster": "K7",
      "title": "Abstract-only evidence for lee2021",
      "severity": "minor",
      "members": [],
      "flags": [
        "F3"
      ],
      "agreement": "single",
      "evidence_for": [],
      "evidence_against": [],
      "blocker": false,
      "scite_status": "ok",
      "recommendation": "defer",
      "rationale": "Only the abstract was available; check the full text by hand."
    }
  ]
}
